{"assertions":[{"actual":null,"assertion_id":"one-active-booking","evidence":[{"artifact_id":"0dd95c52-35bf-557e-b242-5bbdaa00b431","json_pointer":""}],"expected":1,"reason":"Transport fixture; business result is supplied by Intelligence.","required":true,"rule_id":"booking.count.v1","status":"inconclusive"}],"attempt_no":1,"completeness":{"audio":null,"conversation":true,"environment":false,"tools":true},"evaluation_id":"bc2d92e5-fae9-5d4c-9dca-283d6f3dcf1e","evaluator_version_id":"ddca77af-ab2c-511d-b02c-62c80f9b96d9","manifest_sha256":"33edef649532a82902fdb5d71dd5c1f421d1275bbac2fda505e49c030f8d2f11","project_id":"6c8c58d8-6fb6-5fa0-acf6-4cea25535630","run_id":"a278e53f-0099-50a5-acda-e1189d2bf6cc","schema_version":1,"scores":[],"session_id":"4a210cb8-0311-5192-92ad-baa19c0857d8","simulation_validity":"valid","usage":{"input_tokens":0,"output_tokens":0,"provider_cost_status":"unknown"},"verdict":"inconclusive"}
